{
  "$schema": "https://json-schema.org/draft/2020-12/schema",
  "$id": "https://regprobe.local/registry-research-framework/schemas/metadata.schema.json",
  "title": "v3.2 Metadata",
  "type": "object",
  "required": ["tweak_id", "key_path", "value_name", "value_type", "enrichment"],
  "properties": {
    "$schema": { "type": "string" },
    "tweak_id": { "type": "string" },
    "key_path": { "type": ["string", "null"] },
    "value_name": { "type": ["string", "null"] },
    "value_type": { "type": ["string", "null"] },
    "value_data_before": {},
    "value_data_after": {},
    "enrichment": { "type": "object" },
    "doc_source": { "type": "object" }
  }
}
