{
  "$schema": "registry-evidence-v3.1/metadata",
  "tweak_id": "power.session-watchdog-timeouts",
  "key_path": "HKLM\\SYSTEM\\CurrentControlSet\\Control\\Session Manager\\Power",
  "value_name": "WatchdogResumeTimeout / WatchdogSleepTimeout",
  "value_type": "REG_DWORD pair",
  "value_data_before": "WatchdogResumeTimeout=120;WatchdogSleepTimeout=300",
  "value_data_after": "WatchdogResumeTimeout=120;WatchdogSleepTimeout=300",
  "enrichment": {
    "hive": "HKLM",
    "suspected_layer": "kernel",
    "boot_phase_relevant": true,
    "acl_owner": null,
    "acl_sddl": null,
    "acl_user_readable": null,
    "source": "repo_research",
    "official_doc_exists": false,
    "reactos_reference": false,
    "geoff_chappell_reference": false,
    "pdb_symbol_match": null,
    "source_repositories": []
  }
}
